Link,Title,Body
https://apnews.com/article/honduras-abortion-total-ban-723473fb24e14f0401e0a7428ae78eb5,['DeSantis super PAC tackles tricky task of organizing support for him in Iowa without the candidate'],"['SIOUX CENTER, Iowa (AP) — LaTomah Hauff stopped at the red-draped table on her way into Dean’s Classic Car Museum to jot her contact information on a sign-up sheet to hear more about ', '. ', 'The 75-year-old retired speech pathologist had driven an hour to hear the ', ' speak in northwest Iowa last Saturday. She was one of more than 600 Iowa Republicans who filed into the exhibit hall and past the display’s brochures about DeSantis and cards to sign pledging support for him in next year’s ', 'The display, with all the earmarks of a presidential campaign, was the work of ', ', a super political action committee promoting DeSantis while he moves toward a ', '.', 'It was also an early glimpse of how this group — able to receive unlimited sums from wealthy donors, unlike a presidential campaign — plans to build a network of supporters necessary to compete in the caucuses. ', 'Essentially, it’s a caucus campaign that, for legal reasons, cannot attach itself explicitly to a candidate.', 'The novel approach, aimed at maximizing super PAC dollars, underscores the stakes in Iowa for DeSantis. He needs to show early that he is a viable threat to ', ', whose team says it has already signed up thousands of Iowa volunteers and supporters before DeSantis has even declared his candidacy.', 'The effort comes with thorny challenges. The super PAC must essentially build a separate grassroots network to finagle commitments from Iowans to support DeSantis without coordinating with him.', '“The biggest difficulty is the tightrope they are going to have to walk,” said Marlys Popma, a veteran Iowa Republican campaign organizer and former top adviser to John McCain’s 2008 presidential campaign. “Walking that line is going to be the most interesting thing, but I certainly see that it can be done and I think it’s a really interesting approach.”', 'About 240 miles southeast of the fundraiser DeSantis headlined in Republican-heavy Sioux County, the real work of Never Back Down was well under way. ', 'In an office in Des Moines’ western suburbs, Republican operatives had by mid-May conducted three five-day training sessions for classes of paid organizers, with three more scheduled for June. By early May, the group had hired more than a half-dozen seasoned political strategists and recruited volunteers from veteran statewide organizers, including former senior aides to Gov. Kim Reynolds and former Gov. Terry Branstad. ', 'As of early May, the teams had canvassed at least 1,000 addresses, and planned to double that by Sunday. ', 'The goal is to secure commitments to back DeSantis at the caucuses, which are expected to lead off the 2024 Republican voting season, in all of the 1,670 precincts where the party plans to hold them next year. ', '“When you talk about caucus organizing, there are a lot of layers. But our particular layer is trying to build a ground game, build a volunteer network,” super PAC senior adviser David Polyansky said. ', 'He said similar plans were in place in New Hampshire, South Carolina, Nevada and other early states.', 'Officials plan to make the Des Moines-area headquarters the training hub for more than 30 organizers the super PAC plans to hire and dispatch to the four early-contest states and more than a dozen others expected to hold their contests by next March 5, so-called Super Tuesday. ', 'A spokeswoman for the super PAC declined to suggest a budget for the Iowa operation. But Never Back Down has raised more than $30 million, and DeSantis has more than $80 million in his gubernatorial campaign account that is expected to be transferred into the super PAC. ', 'Advisers for Never Back Down are betting the money is better spent on staff, door-knocking and phone-banking than advertising. ', 'Ad sellers are required by law to offer a candidate’s campaign the cheapest rate, a legal distinction intended to make it easier for candidates to communicate to voters. That doesn’t apply to super PACs, which often pay exorbitant rates.', 'Polyansky is among several GOP operatives with Iowa experience advising the super PAC. Like fellow senior adviser Jeff Roe and pollster Chris Wilson, he was part of Texas Sen. Ted Cruz’s winning 2016 Iowa caucus campaign. ', 'Organizing alone hardly guarantees success in Iowa, but it’s essential in quirky contests that require voters to attend evening meetings in the dead of winter. PAC dollars can make a difference in pursuit of a comparatively small number of supporters. ', 'In 2016, ', ' amid record turnout of roughly 180,000 with fewer than 52,000 votes.', 'Barack Obama’s 2008 campaign used the contact information his local organizing staff collected from the large crowds he drew to his Iowa events to draw huge numbers of first-time participants to his ranks, fueling his caucus victory. ', 'Trump, too, packed venues during his 2016 Iowa campaign, but his senior advisers, who had little understanding of the caucuses, failed to follow up with thousands of Iowans, costing him the early win. ', 'This time, Trump’s top aides say they expect the former president to win Iowa in no small part by directing his audiences to a website tailored to connecting interested Iowans with local organizers. ', 'They had expected to sign up thousands at an outdoor rally in Des Moines the same day DeSantis was in northwest Iowa, but the threat of severe storms prompted Trump to cancel. Trump’s campaign expects to make up the event in June. ', 'Even with its big budget and a potential army of staff canvassing Iowa, an organizing campaign without the candidate is at a disadvantage, said veteran Republican strategist Mike Murphy. ', 'Murphy led a pro-Jeb Bush super PAC’s effort to promote the former Florida governor’s campaign for the 2016 Republican presidential nomination. With a $100 million budget, Right to Rise emphasized messaging via advertising and direct mail.', 'But Bush fell from his perch as the field’s early favorite, due in part to his failure to ignite enthusiasm and recognize Trump’s viability. ', 'A super PACs’ strengths lies in echoing a candidate’s messages or attacking opponents. Persuading voters to commit to attending caucuses almost necessarily requires the presence of the candidate, Murphy said.', '“If you don’t have the candidate — or a strong surrogate, like a spouse — to do the tour and meet people in a state with a culture of candidate interaction, it’s hard to have a big organic impact, and that’s what they are going to run into,” Murphy said. ', 'If last Saturday was any preview, the super PAC seemed ready to shadow DeSantis, with all the trappings of a local, organizing campaign, including “DeSantis ’24” yard signs.', 'Hauff, the retired speech pathologist, will be a good test. ', 'Though she signed up for more information, she stopped short of signing one of the caucus pledge cards next to the glossy brochures. ', '“I like what the man says. I like what he’s done in Florida. But it’s early,” Hauff said. “I’m not ready to make a full commitment right now. I want to see how this is going to shake out. He’s one of the names on my list.”']"
https://apnews.com/article/oregon-senate-republican-walkout-0490a4e750297cf392797724b0e414ae,"['Nebraska lawmakers pass 12-week abortion ban, restrictions on gender-affirming care for minors']","['LINCOLN, Neb. (AP) — The Nebraska Legislature on Friday approved a 12-week abortion ban and restrictions on gender-affirming care for people younger than 19 in a move so contentious that lawmakers on both sides have said they may be unable to work together in the future.', 'Conservative lawmakers called in a visibly ill colleague so they would have enough votes to end a filibuster and pass a bill with both measures. Republican Gov. Jim Pillen, who pushed for the bill, has promised to sign it into law.', 'The mood in the Nebraska Capitol has been volatile since lawmakers on Tuesday advanced by a single vote the ', ' that ties together restrictions that Republicans have pursued across the U.S. One lawmaker, Omaha state Sen. Megan Hunt, disclosed in March that her teenage son is transgender and said Friday that she now plans to leave the state.', 'North Carolina also passed a 12-week abortion ban this week, among a slew of restrictions enacted in states after the U.S. Supreme Court last year ', ' the 1973 Roe v. Wade ruling that established a nationwide right to abortion. Fourteen states now have bans throughout pregnancy.', 'Nebraska, however, had not passed new restrictions while continuing to prohibit abortion starting around 20 weeks of pregnancy. The 12-week ban includes exceptions for rape, incest and to save the life of the mother. Opponents unsuccessfully sought an exception for fatal fetal anomalies and to explicitly protect doctors from criminal charges for performing a contested abortion.', 'The bill also would prevent transgender people under 19 from receiving any gender-confirming surgery. It would also restrict the use of hormone treatments and puberty blockers in minors, putting the state’s chief medical officer — a political appointee who is an ear, nose and throat doctor — in charge of setting the rules for those therapies. In Nebraska, people younger than 19 are considered minors.', 'At least 17 states have enacted laws restricting or banning gender-affirming medical care for minors, and proposals are pending before the governors of Texas and Missouri. Medical groups and advocates say such restrictions are further marginalizing transgender youth and threatening their health.', 'Nebraska’s restrictions on gender-affirming care wouldn’t take effect until Oct. 1. The abortion ban will take effect as soon as the governor signs it. Bill opponents promised to sue to stop both measures. ', 'Friday’s debate was briefly halted when protesters in a chamber balcony stood and yelled obscenities at conservative lawmakers while throwing what appeared to be bloody tampons onto the floor. The Nebraska State Patrol cleared both balconies and said at least six people were arrested. As lawmakers began voting, hundreds of protesters packed into the Capitol rotunda shouted, “Shame! Shame! Shame! Shame!” just outside the chamber.', 'Hundreds of businesses and medical professionals signed letters warning that both the abortion ban and the trans health restrictions would prompt corporations and doctors to leave the state. A letter submitted Friday and signed by more than 1,200 Nebraska medical professionals called the bill “a direct attack on the medical community of our state.”', 'Sen. Kathleen Kauth, who authored the trans health measure, has repeatedly referred to an increase of children who identify as transgender as “a social contagion.” She said the measure is aimed at protecting children from doing something they might later regret.', '“It does not mean by any stretch of the imagination that we hate them,” she said. “Quite to the contrary: We love them.”', ' was the genesis of ', ' who along with a handful of progressive allies, including Hunt, have slowed the business of passing laws to a crawl by introducing amendment after amendment to every bill that made it to the Senate floor. That sent leadership scrambling to prioritize which bills to push through. ', 'After lawmakers merged the abortion limits with the transgender health bill, state Sen. Julie Slama insinuated that conservatives were supporting the restrictions on gender-affirming care simply to retaliate against Cavanaugh. Slama noted that the restrictions did not initially have the 33 votes needed to survive.', 'On Friday, Cavanaugh vowed to continue her filibuster until the end of this year’s session in early June and even through all of 2024. ', '“This place is morally bankrupt,” Cavanaugh said. “I’m looking forward to 2025 when I no longer have to serve with many of you.”', 'Conservatives in the one-house, officially nonpartisan Legislature announced early this month that they would amend the trans health bill to squeeze in the abortion restrictions. That unconventional move came after conservatives ', ' that would have banned abortion once ', ' can be detected — generally around six weeks of pregnancy, before many women know they are pregnant. ', 'Legislative rules state that a bill failing to defeat a filibuster must be tabled for the year. So opponents were surprised by ', 'Left-leaning lawmakers complained that conservatives essentially created a new bill that received no public hearing. They also say it violates state law that requires amendments be related to the underlying bill. ']"
https://apnews.com/article/supreme-court-justice-covid-emergency-restrictions-85401feb29bea6db2f2ea4ac61cdeff2,"['Debt limit talks start, stop as Republicans, White House face ‘serious differences’']","['WASHINGTON (AP) — ', ' talks between the White House and House Republicans stopped, started and stopped again Friday at the U.S. Capitol, a dizzying series of events in high-stakes negotiations to avoid a potentially catastrophic federal default.', 'President Joe Biden’s administration ', ' with Republicans led by House Speaker Kevin McCarthy as the nation faces a deadline as soon as June 1 to raise the country’s borrowing limit, now at $31 trillion, to keep paying the nation’s bills. Republicans are demanding ', ' the Democrats oppose.', 'Negotiations came to an abrupt standstill earlier in the day when McCarthy said it’s time to “pause” talks. But the negotiating teams convened again in the evening only to quickly call it quits for the night. ', 'Biden, attending the Group of Seven summit in Japan, continued to express optimism that an agreement will be reached, saying that negotiating happens “in stages.”', '“I still believe we’ll be able to avoid a default and get something done,” he said. ', 'His press secretary, Karine Jean-Pierre, earlier had acknowledged the difficulty of the talks. ', '“There’s no question we have serious differences,” she said, without outlining any of them. ', 'Top Republican negotiators for McCarthy said after the evening session that they were uncertain on next steps, though it’s likely discussions will resume over the weekend. The White House publicly expressed optimism that a resolution could be reached if parties negotiated in “good faith.”', '“We reengaged, had a very, very candid discussion, talking about where we are, talking about where things need to be, what’s reasonably acceptable,” said Rep. Garret Graves, R-La., a top McCarthy ally leading the talks for his side.', 'Another Republican negotiator, Rep. Patrick McHenry of North Carolina, was asked if he was confident an agreement over budget issues could be reached with the White House. He replied, “No.”', 'As the White House team left the nighttime session, counselor to the president Steve Ricchetti, who is leading talks for the Democrats, said he was hopeful. “We’re going to keep working,” he said.', 'Biden had already planned to cut short the rest of his trip and is expected to return to Washington Sunday night.', 'Earlier in the day, McCarthy said resolution to the standoff is “easy,” if only Biden’s team would agree to some ', ' Republicans are demanding. The biggest impasse was over the fiscal 2024 top-line budget amount, according to a person briefed on the talks and granted anonymity to discuss them. Democrats staunchly oppose the steep reductions Republicans have put on the table as potentially harmful to Americans, and are insisting that Republicans agree to tax hikes on the wealthy, in addition to spending cuts, to close the deficit.', '“We’ve got to get movement by the White House and we don’t have any movement yet,” ', ' told reporters at the Capitol. “So, yeah, we’ve got to pause.” ', 'White House communications director Ben LaBolt said Saturday that “Any serious budget negotiation must include discussion both of spending and of revenues, but Republicans have refused to discuss revenue.”', 'He added: “President Biden will not accept a wishlist of extreme MAGA priorities that would punish the middle class and neediest Americans and set our economic progress back.”', 'Jean-Pierre insisted Biden was not negotiating on raising the borrowing limit, despite the clear linkage in talks between securing a budget deal and raising the debt ceiling.', '“It is not negotiable — we should not be negotiating on the debt,” she said. ', 'Wall Street ', ' as negotiations came to a sudden halt. Experts have warned that even the threat of a debt default would could spark a recession. ', 'Republicans argue the nation’s deficit spending needs to get under control, aiming to roll back spending to fiscal 2022 levels and restrict future growth. But Biden’s team is countering that the caps Republicans proposed in their House-passed bill would amount to 30% reductions in some programs if Defense and veterans are spared, according to a memo from the Office of Management and Budget. ', 'Any deal would need the support of both Republicans and Democrats to find approval in a divided Congress and be passed into law. Negotiators are eyeing a more narrow budget cap deal of a few years, rather than the decade-long caps Republicans initially wanted, and clawing back some $30 billion of unspent COVID-19 funds. ', 'Still up for debate are policy changes, including a framework for permitting reforms to speed the development of energy projects, as well as the Republican push to impose work requirements on government aid recipients that Biden has been open to but the House Democratic leader Hakeem Jeffries has said was a “nonstarter.”', '“Look, we can’t be spending more money next year,” McCarthy said at the Capitol. “We have to spend less than we spent the year before. It’s pretty easy.”', 'McCarthy faces pressures from his hard-right flank to cut the strongest deal possible for Republicans, and he risks a threat to his leadership as speaker if he fails to deliver. Many House Republicans are unlikely to accept any deal with the White House.', 'The internal political dynamics confronting the embattled McCarthy leave the Democrats skeptical about giving away too much to the Republicans and driving off the support they will need to pass any compromise through Congress.', 'Biden is facing increased pushback from Democrats, particularly progressives, who argue the reductions will fall too heavily on domestic programs that Americans rely on. ', 'Some Democrats want Biden to invoke his authority ', ' to raise the debt ceiling on his own, an idea that raises legal questions and that the president has so far said he is not inclined to consider.', 'Pressure on McCarthy comes from the conservative House Freedom Caucus, which said late Thursday there should be no further discussions until the Senate takes action on the House Republican plan. That bill approved last month would raise the debt limit into 2024 in exchange for spending caps and policy changes. Biden has said he would veto that Republican measure.', 'In the Senate, which is controlled by majority Democrats, Republican leader Mitch McConnell has taken a backseat publicly, and is pushing Biden to strike a deal directly with McCarthy.', '“They are the only two who can reach an agreement,” McConnell said in a tweet. “It is past time for the White House to get serious. Time is of the essence.”', '___', 'Miller reported from Hiroshima, Japan. Associated Press Business Writer Stan Choe and writers Kevin Freking, Seung Min Kim, Stephen Groves and Mary Clare Jalonick in Washington and Josh Boak in Hiroshima, Japan, contributed to this report.']"
https://apnews.com/article/jim-brown-cleveland-browns-nfl-45671a4e88c39f375d37c174b30a0282,"['Jimmy Butler scores 27, Miami beats Boston 111-105 to take 2-0 lead in East finals']","['BOSTON (AP) — Jimmy Butler went forehead-to-forehead with the Boston Celtics, and the Heat are heading back to Miami with an opportunity to advance to the NBA Finals. ', 'Butler scored 27 points, hitting back-to-back buckets to tie the game and give Miami the lead, and the eighth-seeded Heat left Boston with a 111-105 victory Friday night and a 2-0 lead in the Eastern Conference finals.', 'Butler also provided eight rebounds, six assists and an emotional spark after Boston’s Grant Williams started jawing with him: Butler stared down Williams, with both players drawing technical fouls for the double head-butt.', 'Then “Jimmy Buckets” scored and scored some more — nine points in all during a 23-9 run that turned a nine-point deficit into a 105-100 lead. ', '“I knew that was going to be good for us,” said Caleb Martin, who came off the bench to score 25 points. “We’ll take mad Jimmy at any time. You could kind of see it in his eyes he was ready to go after that.”', 'Bam Adebayo had 22 points, 17 rebounds and nine assists for Miami, which returns home with a chance to sweep and become just the second No. 8 seed to reach the NBA Finals.', 'Game 3 is Sunday night. ', '“He’s going to have to make every single tough shot the rest of the series,” Williams said. “And I’m not going to turn and look otherwise because I respect him as an (expletive) player.”', 'Jayson Tatum had 34 points, 13 rebounds and eight assists for Boston. But the Celtics star went 0 for 3 with two turnovers in the fourth quarter, when Boston blew an 89-77 lead en route to a second home loss in three nights.', 'After finishing 13 games ahead of the Heat in the regular-season -- and then watching top-seeded Milwaukee fall to Miami in the first round -- the Celtics have stumbled on what appeared to be a clear path to their second straight NBA Finals.', '“It’s tough. It’s a challenge. But there’s no point being up here sad and (stuff),” Tatum said. “They came in and won two games. They played well; you give them credit. But we’re not dead or anything. We’ve got a great opportunity. I still have the utmost confidence. Everybody has the utmost confidence. We’ve just got to get ready for Game 3.”', 'Jaylen Brown scored 16 points on 7-for-23 shooting; he went 1 for 5 with a turnover in the final quarter, when Miami outscored Boston 36-22.', '“We’ve got some dogs, and I love it. I love every bit of it,” Butler said on the postgame TV broadcast. “Guys never quit. We never give up. We love playing with one another. We’ve got so much faith and trust in one another.”', 'The Celtics led by 11 in the third quarter and made it a dozen early in the fourth. Williams made a 3-pointer to make it 96-87 and was talking to Butler on the way back down the court. Butler scored at the other end and was fouled by Williams; the two players leaned into each other — drawing double technicals — before Butler hit the ensuing free throw.', '“Some healthy competition. I ain’t going to lie to you. Healthy competition. And I love it. I’m always here to compete. I like to talk, at times,” Butler said. “As long as we get the win, I’m good with it.”', 'Asked if Boston “poked the bear” by getting Butler angry, Brown said, “Next question.” But Butler said there was no doubt that the attempt to get him off his game actually fired him up.', '“Yes it did,” Butler said. “But that’s just competition at its finest. He hit a big shot and started talking to me. But I like that. It’s just competition. It pushes that will to win. It makes me smile. ... I just don’t know if I was the best person to talk to.”', 'After Tatum missed from long distance — one of three missed 3s in the fourth quarter — Butler drove to the basket to make it a four-point Boston lead. Miami trailed 98-96 when Butler was called for an offensive foul, kicking Marcus Smart after landing on a missed 3-pointer.', 'Heat coach Erik Spoelstra challenged, but lost.', 'Butler responded.', 'He made a 17-footer to tie it 100-all, and then a short fadeaway to give Miami the lead. After Max Strus made one of two free throws, Adebayo scored on a putback dunk to make it 105-100 with less than a minute to play.', '“I love that gnarly version of Jimmy,” Spoelstra said. “But you get that regardless. I think now people are just paying more attention. ... Jimmy is just a real competitor.” ', 'Boston used a 21-2 run to turn an eight-point, first-quarter deficit into an 11-point lead.', 'TIP-INS', 'Brown was 1 for 7 in the first quarter, when Tatum scored 12. Derrick White, who made a single 3-pointer, was the only player other than Tatum who scored more than 2 points in the first. … Adebayo and Butler each grabbed five rebounds in the first quarter. … Lowry and Grant Williams did a little shoving after Williams fouled Adebayo with nine minutes left in the second quarter, with no repercussions. ', '___', 'AP NBA: https://apnews.com/hub/NBA and https://twitter.com/AP_Sports ']"
