Link,Title,Body
https://apnews.com/article/rachael-rollins-massachusetts-us-attorney-resigns-42f9111ea4aedbcc6a1ba9f6313cfe6e,['Murray’s big fourth quarter propels Nuggets past Lakers 108-103 for 2-0 lead in West finals'],"['DENVER (AP) — After Nikola Jokic’s monster game in the opener, his pick-and-roll partner Jamal Murray took the spotlight in the Western Conference finals Thursday night. ', 'Murray scored 23 of his 37 points in the fourth quarter, propelling the Denver Nuggets to a 108-103 come-from-behind win over the Los Angeles Lakers for a 2-0 lead in the series.', '“He was special,” Jokic said. “He won us the game basically.”', 'Murray missed 12 of his 17 shots through three quarters but found his touch in the fourth, going 6 for 7, including four 3-pointers, and fueling a 15-1 run that gave Denver a 96-84 lead.', '“He made shots at the end of the clock,” LeBron James lamented. “We guard for 24 seconds and he made two big-time shots, one over (Anthony Davis) and one over me. He had his 3-point shot going in the fourth. It’s no surprise to me, he’s done it before. Sometimes it’s a never-miss league.” ', 'In all, Denver sank seven 3s in the fourth quarter after hitting seven all night.', '“It would have been a lot easier if I had made them in the first half,” said Murray, who is still playing through an earache he hasn’t been able to shake since Round 2.', 'Jokic added 23 points, 17 rebounds and a dozen assists a day after ESPN sideline reporter Lisa Salters handed the Nuggets the no-respect card by acknowledging that ', ' Game 1, when he had 34 points, 21 boards and 14 assists.', '“For those that don’t know him, he’s got 13 playoff triple-doubles now,” Malone sneered after Game 2. “It’s just incredible what he continues to do on a nightly basis on the biggest stage in the world.”', 'As for Jokic, he brushed off the slights on him and his teammates, saying, “It’s nothing new for us.”', 'Malone was plenty miffed by the Lakers getting all the pub.', '“You win Game 1 and all everybody talked about was the Lakers,” Malone said. “Let’s be honest, the national narrative was, ‘Hey, the Lakers are fine. They’re down 1-0, but they figured something out.’ No one talked about how Nikola just had an historic performance. He’s got 13 (playoff) triple-doubles now, third all-time. What he’s doing is just incredible. ', '“But their narrative wasn’t about the Nuggets. The narrative wasn’t about Nikola. The narrative was about the Lakers and their adjustments. So you know, you put that in your pipe and you smoke it, you come back and you know what, we’re gonna go up 2-0.”', 'The Nuggets have never been this close to reaching the NBA Finals in their history. Game 3 is Saturday night at Crypto.com Arena, where James and the Lakers are 8-0 in the playoffs.', 'Malone said he reminded Murray heading into the fourth quarter not to fret over his shooting woes but to focus on contributing in other ways. He heeded that advice, grabbing three big boards on defense and stealing the ball twice besides hitting 4-of-5 from deep and 7-of-8 from the stripe. ', '“Three-point line is what killed us in the fourth,” James said.', 'Malone knew that when Murray finally found the net, many more buckets would follow.', '“We all know ... he just has to see one go in,” Malone said, and when that happened, “he kind of looked up to the heavens and that’s all he needs. And after that he’s shooting into a hula hoop.”', 'Just like in Game 1, the Lakers didn’t go down easily. They pulled to three points on Austin Reaves’ jumper before Murray sank two free throws with 12 seconds left and Bruce Brown stole the ball from James, then dribbled out the final 8 seconds.', 'The Nuggets improved to 41-8 at home, best in the NBA, including 8-0 in the playoffs.', 'James and Reaves both scored 22 for Los Angeles. Davis scored 18 after pouring in 40 in the opener and Rui Hachimra scored 21 points off the bench.', 'For much of the night, it appeared as though the Lakers would wrest home-court advantage from the Nuggets, who are the top seed for the first time in their history. The Lakers won the series openers at Memphis and Golden State to reach the conference championship.', 'The outstanding defense Hachimura played on Jokic in the fourth quarter of the Lakers’ loss in Game 1 led many to believe coach Darvin Ham would start Hachimura to try to stymie the Nuggets’ star center from the start. But instead he came off the bench again, scoring 17 first-half points but just four thereafter.', '“Proud of our guys,” Ham said. “They bounced back. We addressed a lot of the things that we said we were going to try to do better. Still got to be better in transition D. But overall the energy was there, the effort was there, the urgency was there, we just caught a bad stretch.”', 'And a suddenly red-hot Jamal Murray.', 'TIP-INS', 'Lakers: Los Angeles made 23 of 26 free throws. ... Davis and James were a combined 13 of 36 from the floor.', 'Nuggets: After watching the Lakers start the second quarter on a 9-0 run with Jokic and Murray on the bench, Malone kept Jokic in to start the fourth quarter. “Nikola’s like Secretariat, man,” Malone said. “That guy can run for days.”', '___', 'AP NBA: ', ' and and ']"
https://apnews.com/article/nfl-jim-brown-03d88c7da08840a0921ae8d8dd0a6aaa,['Dubai’s next big thing? Perhaps a $5 billion man-made ‘moon’ as the city’s real estate market booms'],"['DUBAI, United Arab Emirates (AP) — Who says you cannot reach for the moon? A proposed $5 billion real estate project wants to take skyscraper-studded Dubai to new heights — by bringing a symbol of the heavens down to Earth.', 'Canadian entrepreneur Michael Henderson envisions building a 274-meter (900-foot) replica of the moon atop a 30-meter (100-foot) building in Dubai, already home to the world’s tallest building and other architectural wonders. ', 'Henderson’s project, dubbed MOON, may sound out of this world, but it could easily fit in this futuristic city-state. Dubai already has a red-hot real estate market, fueled by the wealthy who ', ' and ', '. ', 'And even though a previous booms-and-bust cycle saw many grand projects collapse, Henderson and others suggest his vision, funded by Moon World Resorts Inc., where he is the co-founder, might not be that far-fetched.', '“We have the biggest ‘brand’ in the world,” Henderson told The Associated Press, alluding that the moon itself — the heavenly body — was his brand. “Eight billion people know our brand, and we haven’t even started yet.”', 'The project Henderson proposes includes a destination resort inside the spherical structure, complete with a 4,000-room hotel, an arena capable of hosting 10,000 people and a “lunar colony” that would give guests the sensation of actually walking on the moon. ', 'The MOON would sit on a pedestal-like circular building beneath it and would glow at night. Henderson discussed the project at the Arabian Travel Market earlier in May in Dubai. ', 'Already, artist renderings commissioned by Moon World Resorts have played with the location for his MOON — including at the Burj Khalifa, the world’s tallest building at a height of 828 meters (2,710 feet). Others have placed it at the Dubai Pearl, a long-dormant project now being destroyed near the man-made Palm Jumeirah archipelago, and on its unfinished sister, the Palm Jebel Ali. ', 'The Pearl and the Palm Jebel Ali represent two “white elephant” projects left over from the 2009 financial crisis that rocked the sheikhdom and forced Abu Dhabi, the capital of the United Arab Emirates, to provide Dubai with a $20 billion bailout. ', 'Now nearly 15 years later, Dubai largely has turned around. Rents on average across Dubai are up 26.9% year-on-year, even with anti-price-gouging protections. Dubai saw 86,849 residential sales last year, beating a previous record of 80,831 from 2009.', '“Dubai is in a completely different world compared to” 2009, said Lewis Allsopp, the CEO of the prominent Dubai real estate agency Allsopp & Allsopp. Launched products are “selling out on the spot.”', 'Inflation and interest rate hikes around the world have led to fears of a global recession. The UAE’s currency, the dirham, is pegged to the dollar, meaning it has followed lock-step the hikes imposed by the Federal Reserve. ', 'But cash still remains king for Dubai buyers, with fourth-fifths of transactions paid in currency without financing in 2022, said Faisal Durrani, the head of Middle East research at real estate agency Knight Frank. ', '“You could argue that the interest rate hikes that are taking place, to an extent the market is a little bit shielded from that given the fact that so much of the transactional activity has been driven by cash,” Durrani said.', 'Other major projects are moving ahead. ', 'Nakheel, the state-owned developer behind the Palm Jebel Ali, has relaunched development plans for it. The developer also unveiled a multibillion-dollar plan to build 80 resorts and hotels on the man-made Dubai Islands, though it remains largely empty and under the flight path of the nearby Dubai International Airport, the world’s busiest for international travel. ', 'The MOON project also includes space for a possible casino as well. Gambling remains illegal in the UAE, a federation of seven hereditarily ruled sheikhdoms on the Arabian Peninsula. However, major brands like Caesar’s Palace already exist or hope to build in Dubai. ', ' with gambling to open in 2027 — meaning a change to the law is likely to come. ', 'Like other high-profile, eye-catching marvels, the MOON could fit well into “the legitimacy formula of Dubai’s ruling elite,” said Christopher Davidson, a Middle East expert who wrote the recent book “From Sheikhs to Sultanism.” Dubai also hosts the UAE’s space center, which ', ' and ', '. ', '“They can be seen as a non-democratic elite but nonetheless believe strongly in science and progress — and that’s ultimately very legitimizing and a megaproject like this would seem to tick all of those boxes,” Davidson said.', 'Henderson’s plan would go a step further than other globe-shaped projects, such as ', ', a $2.3 billion dome blanketed by LED screens, that is set to open in Las Vegas later this year. ', 'His structure would be fully spherical, and could be illuminated alternatively as a full, half or crescent moon. ', 'The brightness may not go down well with potential neighbors — plans to build another MSG Sphere in London were halted after residents protested the significant light pollution and disruption the structure would cause. ', '“It’s hard to please everybody,” Henderson acknowledged. “You might need dark curtains.”', '___', 'Associated Press writer Jon Gambrell in Dubai, United Arab Emirates, contributed to this report.']"
https://apnews.com/article/justice-department-fbi-surveillance-75c466a64e838ab12eaef96f6335f3cd,"['Tkachuk ends 6th-longest game in NHL history, Panthers outlast Hurricanes 3-2 in 4th OT']","['RALEIGH, N.C. (AP) — Back and forth they went, the Florida Panthers and Carolina Hurricanes playing a game that seemed destined to have no end while leaving legs growing wobbly with each passing minute.', 'Then, just as the teams appeared headed for yet another extra period, Matthew Tkachuk pounced on his chance to finish off yet another overtime and road victory for the Panthers in these playoffs.', 'Tkachuk beat Frederik Andersen in the final seconds of the fourth overtime to give the Panthers a 3-2 victory over the Hurricanes early Friday in Game 1 of the Eastern Conference final.', 'Tkachuk took a feed from Sam Bennett after Florida won a battle for the puck as Carolina tried to clear it from the zone, then whipped a shot from the right circle past Andersen with 12.7 seconds left.', 'That sent Tkachuk racing toward center ice to celebrate with teammates in what turned into the longest game in the history of either franchise, as well as the sixth-longest game in NHL history.', '“Definitely, tired but I think you’re less tired when you win,” Tkachuk said, adding: “I hope you guys and everybody else enjoyed that game, because what I’m seeing is two really good teams fighting it out for every inch.”', 'Florida won its seventh straight road game in these playoffs and improved to 5-0 in overtime. Game 2 is Saturday night in Raleigh, less than 48 hours after the teams played more than two full games worth of hockey.', 'This one ended roughly six hours after the puck drop.', '“We didn’t even know what overtime we were in,” Panthers forward Ryan Lomberg said.', 'Aleksander Barkov and Carter Verhaeghe scored in regulation for the Panthers, and Sergei Bobrovsky made 63 saves in what turned into a goaltender battle as the game got more ragged and players racked up the ice time.', 'Andersen finished with 57 saves for Carolina, which got power-play goals from Seth Jarvis and Stefan Noesen.', '“It was a good goalie battle,” Carolina coach Rod Brind’Amour said. “It was unfortunate we just couldn’t find one.”', 'Tkachuk finally ended a game that had multiple wild sequences in critical late moments.', 'Most notably, there was Lomberg appearing to have the winning goal in his return to Florida’s lineup from injury, beating Jalen Chatfield in a battle and then whipping the puck by Andersen 2 1/2 minutes into the first OT.', 'But Carolina successfully challenged the play for goaltender interference. Replays showed Florida’s Colin White — while being bumped by Carolina’s Jack Drury — making skate-to-skate contact with Andersen, then bumping him as Andersen ended up on all fours on the other side of the crease before Lomberg’s shot found the net.', 'Later in that first OT, Jarvis — who had the game’s first goal on a power-play blast from the slot — nearly ended it on a loose rebound but rang the crossbar.', 'It turned out, the game was nowhere near its epic finish.', 'Florida hadn’t been to an Eastern Conference final since 1996, before a large chunk of its roster had even been born. But these Panthers had turned a late surge to qualify for the final wild-card spot into a postseason-shaking moment by taking down Boston following the Bruins’ record-setting 65 wins and 135 points, followed by beating a Toronto team buzzing off its first series win in nearly two decades.', 'Now the Panthers have handed the Hurricanes — who had the league’s second-best regular-season record — their first series deficit of the postseason.', 'Carolina is in the Eastern final for the second time in five years. The last time, it was a feel-good surprise for a young core that had just ended a nine-year postseason drought. They had since accomplished the goal of building a consistent winner and Cup contender, though second-round exits the past two seasons on home ice had cast a damper on some of that sustained success.', 'This time, Carolina beat the New York Islanders in six games and then the New Jersey Devils in five to make it back. But on a night when both teams had plenty of chances to end this one in any of the OTs, Carolina ended up losing its ninth straight game in the conference-final round dating to 2009 in brutal fashion.', '“It was kind of really who was going to make the last mistake,” Carolina captain Jordan Staal said. “Unfortunately, it was us.”', 'LONGEST GAME', 'The longest game in NHL history came on March 24, 1936, when the Detroit Red Wings beat the Montreal Maroons 1-0 in the sixth overtime on Mud Bruneteau’s goal at 116 minutes, 30 seconds of extra play.', 'FRANCHISE MARKS', 'Florida’s previous record for longest game was 104:31 in Game 4 of the 1996 Stanley Cup final against Colorado. Carolina’s previous record was 114:47 for Game 3 of the 2002 Stanley Cup final. The teams each lost those games.', 'SEMIFINAL SKID', 'Carolina’s losing streak in the NHL semifinals dates to Pittsburgh’s sweep of the Hurricanes in 2009 when Maurice was in his second stint as Carolina’s coach. Boston then swept the Hurricanes a decade later.', 'WELCOME BACK', 'Both teams welcomed back forwards from lengthy injuries.', 'Carolina’s Teuvo Teravainen hadn’t played since suffering what the team described as a hand injury in Game 2 of the first-round series against the New York Islanders. The injury required surgery on April 20 and left him with a scar running the length of his left thumb.', 'Lomberg had missed eight straight games due to an upper-body injury.', '___', 'Follow Aaron Beard on Twitter at http://www.twitter.com/aaronbeardap', '___', 'AP NHL Playoffs: https://apnews.com/hub/stanley-cup and ']"
https://apnews.com/article/motown-spinners-detroit-music-fambrough-6987fd9fff59f63f2bdb1bdf180eaa92,"['What to stream this weekend: Jack Harlow’s acting debut, Kesha, Scott brothers on HGTV']","['This week’s new streaming options include rapper Jack Harlow’s acting debut, the return of Kesha and new projects for an heart-warming HGTV show. ', 'Here’s a collection curated by The Associated Press’ ', ' journalists of what’s arriving on TV, streaming services and music and video game platforms this week.', '— Three decades after Wesley Snipes and Woody Harrelson mixed it up on the black top, a new ', ' has next. A remake of that 1992 film teams Sinqua Walls and rapper Jack Harlow as a pair of basketball players who hustle hoops for money and compete in a lucrative three-on-three tournament. The film, which debuts Friday on Hulu, is directed by Calmatic and co-written by Kenya Barris (“black-ish”). In it, Harlow makes his acting debut. (Read ', ' )', '— Anna Nicole Smith gets the Netflix documentary treatment in ', ' The film, debuting Tuesday, chronicles Smith’s life as a model, Playboy playmate and reality star. Smith died in 2007 at the age of 39 from an accidental overdose. “You Don’t Know Me” includes home video of Smith, whose birth name was Vickie Lynn Hogan.', '— Cristian Mungiu’s ', ' is one of the cinematic highlights of the first half of 2023. The latest from the acclaimed Romanian filmmaker (“4 Months, 3 Weeks and 2 Days”) is a powerful microcosm of a migrant drama that has played out all around the world. A mountainous Transylvania village is increasingly torn apart by violent nationalist impulses that course through the town’s civic life in response to a handful of foreign workers. Mungiu, the pioneering filmmaker of the Romanian New Wave, crafts an unflinching societal portrait both gripping and grim. Currently playing in theaters, “R.M.N.” is available on-demand beginning Friday.', '— ', '— Check out Kesha’s new album for what “post-pop” sounds like. That’s what the ever-changing pop star is calling her Rick Rubin-produced record “Gag Order.” Single ', ' is an introspective, beatless ballad with the lyric “Am I bigger than Jesus/Or better off dead?/There’s a fine line between genius and crazy.” There’s also ', ' an experimental, mournful number. Her team says the album excavates “the deepest recesses of her soul to date.”', '— Def Leppard are following in the footsteps of Metallica, the Scorpions and Bring Me the Horizon with an orchestral reworking of their catalogue. “Drastic Symphonies,” features their greatest tracks reimagined by The Royal Philharmonic Orchestra. Fifteen of the hard rockers’ hits like “Animal,” “Love Bites,” ', ' and “Pour Some Sugar on Me” have a new sound. Some songs — “Rock of Ages,” “Photograph” and “Let’s Get Rocked” — didn’t work and were left off.', '— May turns out to be a great month for 11-time Grammy-nominated singer- songwriter Brandy Clark. Her Broadway musical ', ' and she’s got a new self-titled album out Friday. Produced by Brandi Carlile, the album showcases Clark’s tenderness, with the 11 songs including the heartbreaking ', ' a celebration of her home in ', ' and a loving tribute to her grandma with ', '— Ahead of their ', ', Dave Matthews Band has released two strong singles, including the nostalgia-drenched ', ' with the lyrics “Chutes and ladders/Pick up sticks/Counting cards and counting bricks/Driving past that old five and dime/Can’t get nothing for a nickel since a long long time.” The first single, ', ' leans into Middle Eastern rhythms for a darker song about the madness of violence. Both songs will be on the album “Walk Around the Moon,” out Friday and the band says it “is as much a reflection on the current times as it is an urge to find common ground.”', '— ', '— Stock up on tissues because home renovation twins Drew and Jonathan Scott’s series ', ' is back with new episodes on HGTV. Each episode features a Hollywood star who dreams up a home renovation project for someone they want to give back to. Enter the Scott brothers who use their knowledge of construction to make it happen. The episodes follow each project from start to finish with a heart-warming, emotional presentation at the end. This batch of eight episodes features Heidi Klum, Kristin Chenoweth, Glenn Close, Taraji P. Henson, Emma Roberts, Jay Leno, Derek Hough, Kristin Davis and Emma Roberts. “Celebrity IOU” returns Monday.', '— If you watched the “To All the Boys” movies, you probably remember scene-stealer Anna Cathcart as the confident, chatty kid sister, Kitty, to Lana Condor’s Lara Jean. Cathcart has landed her own spinoff series called ', ' Created by “To All the Boys” author Jenny Han, Kitty travels to Korea to attend an elite boarding school that her long-distance boyfriend is a student at. It’s also the same school where her late mother went as a teen. Kitty imagines a seamless transition to a new school in a new country and a romantic reunion with her boyfriend but quickly realizes life doesn’t always go as planned. All 10 episodes drop Thursday on Netflix.', '— Wilderness expert and adventure-seeker Bear Grylls has never encountered a mountain he won’t climb or a random creature he won’t eat for fuel. We’ve seen him on TV venture into the great outdoors with celebrities but now he’s taking everyday people out of their comfort zone in a new show, ', ' With the help of comedian co-host Jordan Conley, Grylls uses simulated challenges to test contestants on their survival skills, physicality, and gross-out tolerance. Get ready for the hardest, the dirtiest, the most disgusting day of your life,” Grylls says in the trailer. “I Survived Bear Grylls” debuts Thursday on TBS.', '— Alicia Rancilio', '— The Lego brand encompasses all sorts of pop culture icons, from “Star Wars” to “Seinfeld.” But sometimes you just want to build a Lego car and take it for a spin. In 2K Games’ ', ', you can assemble a high-speed racer brick-by-brick, then compete against your friends to find out who’s got the zippiest monster on the track. If you want to go off-road, you can turn your car into an all-terrain vehicle, a boat or even an aircraft. Visual Concepts, the studio behind the NBA 2K franchise, is promising a huge open world in which you can you take your driver from rookie to world champion — or just tool around smashing into things. Your Lego garage opens for business Friday on PlayStation 5/4, Xbox X/S/One, Nintendo Switch and PC.', '— “I awoke one morning to find I was a dog” is a heck of a way to open a video game. ', ' gets weirder from there. The dog is a glowing Shiba Inu, and his mission is to guide the human masses toward salvation at the end of the world. Sounds heavy, but the result is the sort of hypnotic puzzle game you’d expect from Enhance, the developers responsible for Tetris Effect and Rez Infinite. It’s reminiscent of the 1990s classic Lemmings in that you’re trying to steer crowds of mindless creatures away from a gruesome demise, but once the hordes start fighting each other, this pup’s got a whole new set of problems. With 90-plus levels and the tools for users to build their own, Humanity could last for an eternity. The herding begins Tuesday on PlayStation 5/4 and PC.', '— ', '___', 'Catch up on AP’s entertainment coverage here: ']"
