Link,Title,Body
https://apnews.com/article/g7-japan-hiroshima-ukraine-biden-kishida-8d22eac47970b7051000fbd5b0ebba70,['Ukraine’s Zelenskyy arrives in Hiroshima for G7 summit as world leaders sanction Russia'],"['HIROSHIMA, Japan (AP) — Ukrainian President Volodymyr Zelenskyy arrived Saturday in Japan for talks with the leaders of the world’s most powerful democracies, a personal appearance meant to galvanize global attention as the nations ratcheted up pressure on Moscow for its 15-month invasion of Ukraine.', 'Bolstering international support is a key priority as Ukraine prepares for what’s seen as a major push to take back territory seized by Russia in the war that began in February last year. Zelenskyy’s in-person visit to the G7 summit comes just hours after the United States agreed to allow training on ', ', laying the groundwork for their eventual transfer to Ukraine.', 'Host nation Japan said Zelenskyy’s inclusion stems from his “strong wish” to participate in talks with the bloc and other countries that will influence his nation’s defense against Russia.', '“Japan. G7. Important meetings with partners and friends of Ukraine. Security and enhanced cooperation for our victory. Peace will become closer today,” Zelenskyy tweeted upon his arrival on a plane provided by France.', 'A European Union official, speaking on condition of anonymity to brief reporters on the deliberations, said Zelenskyy will take part in two separate sessions Sunday. One session will be with G7 members only and will focus on the war in Ukraine. Another will include the G7 as well as the other nations invited to take part in the summit, and will focus on “peace and stability.”', 'U.S. national security adviser Jake Sullivan said that President Joe Biden and Zelenskyy would have direct engagement at the summit. On Friday, Biden announced his support for training Ukrainian pilots on U.S.-made F-16 fighter jets, a precursor to eventually providing those aircraft to Ukraine.', '“It is necessary to improve (Ukraine’s) air defense capabilities, including the training of our pilots,” Zelenskyy wrote on his official Telegram channel after meeting Italian Premier Giorgia Meloni, one of a number of leaders he talked to. ', 'Zelenskyy also met with Indian Prime Minister Narendra Modi, their first face-to-face talks since the war, and briefed him on Ukraine’s peace plan, which calls for the withdrawal of Russian troops from the country before any negotiations. ', 'Russia’s deputy defense minister, Alexander Grushko, accused Western countries of “continuing along the path of escalation,” following the announcements that raised the possibility of sending F-16s to Kyiv. ', 'The G7 vowed to intensify the pressure in its joint statement Saturday. ', '“Russia’s brutal war of aggression represents a threat to the whole world in breach of fundamental norms, rules and principles of the international community. We reaffirm our unwavering support for Ukraine for as long as it takes to bring a comprehensive, just and lasting peace,” the group said.', 'G7 leaders have faced a balancing act as they look to address a raft of global worries demanding urgent attention, including climate change, AI, poverty and economic instability, nuclear proliferation and, above all, the war in Ukraine.', ', sits at the nexus of many of those concerns.', 'There is increasing anxiety that Beijing, which has been steadily building up its nuclear weapons program, could try to seize Taiwan by force, sparking a wider conflict. China claims the self-governing island as its own and regularly sends ships and warplanes near it.', 'The G7 on Saturday ', ' and were seeking “constructive and stable relations” with Beijing, “recognizing the importance of engaging candidly with and expressing our concerns directly to China.”', 'They also urged China to pressure Russia to end the war in Ukraine and “support a comprehensive, just and lasting peace.”', 'North Korea, which has been testing missiles at a torrid pace, must completely abandon its nuclear bomb ambitions, “including any further nuclear tests or launches that use ballistic missile technology,” the leaders’ statement said. ', 'The green light on F-16 training is the latest shift by the Biden administration as it moves to arm Ukraine with more advanced and lethal weaponry, following earlier decisions to send rocket launcher systems and Abrams tanks. The United States has insisted that it is sending weapons to Ukraine to defend itself and has discouraged attacks by Ukraine into Russian territory.', '“We’ve reached a moment where it is time to look down the road again to say what is Ukraine going to need as part of a future force, to be able to deter and defend against Russian aggression as we go forward,” Sullivan said.', 'Biden’s decisions on when, how many, and who will provide the fourth-generation F-16 fighter jets will be made in the months ahead while the training is underway, Biden told leaders.', 'The G7 leaders have rolled out a ', ' on Moscow as well as plans to enhance the effectiveness of existing financial penalties meant to constrain President Vladimir Putin’s war effort. Russia is now the most-sanctioned country in the world, but there are questions about the effectiveness.', 'Japanese Prime Minister Fumio Kishida separately held one-on-one talks with leaders, including Modi, who is hosting the gathering of G20 world leaders later this year. ', 'India, the world’s largest democracy, has been measured in its comments on the war in Ukraine, and has avoided outright condemnation of Russia’s invasion. While India maintains close ties with the U.S. and its Western allies, it is also a major buyer of Russian arms and oil.', 'The latest sanctions aimed at Russia include tighter restrictions on already-sanctioned people and firms involved in the war effort. More than 125 individuals and organizations across 20 countries have been hit with U.S. sanctions.', 'The leaders began the summit with a visit to a peace park dedicated to the tens of thousands who died in the world’s first wartime atomic bomb detonation. Kishida, who represents Hiroshima in parliament, wants nuclear disarmament to be a major focus of discussions.', 'The G7 leaders also discussed efforts to strengthen the global economy and address rising prices that are squeezing families and government budgets around the world, particularly in developing countries in Africa, Asia and Latin America.', 'The group reiterated its aim to pull together up to $600 billion in financing for the G7’s global infrastructure development initiative, which is meant to offer countries an alternative to China’s investment dollars.', 'Biden, who ', ' after his stay in Japan so that he can get back to debt limit talks in Washington, is also ', ', made up of Japan, Australia, India and the United States.', 'The G7 includes Japan, the United States, the United Kingdom, France, Germany, Canada and Italy, as well as the European Union.', '__', 'Associated Press writers Zeke Miller, Elaine Kurtenbach and Mari Yamaguchi in Hiroshima, Japan, and Joanna Kozlowska in London contributed to this report.']"
https://apnews.com/article/2024-republicans-subway-chokehold-death-be39b29eef4529bf996c13ec5bcd22ef,['FACT FOCUS: Who’s to blame for the national debt? It’s more complicated than one culprit'],"['The U.S. is inching closer to a ', ' or risk defaulting on the nation’s $31 trillion in debt and political leaders ', ' to avert such a crisis.', 'Amid those negotiations, politicians and commentators online have pointed fingers at who they say is to blame for the nation’s exorbitant debt.', 'One claim circulating widely on social media, prompted by House Minority Leader Hakeem Jeffries, posits that former President Donald Trump contributed more to the debt than any other in the White House occupant in history.', 'But that isn’t quite right — and experts say the issue is much more nuanced than a political talking point might let on.', 'Here are the facts.', 'CLAIM: Trump “ran up more debt than any other President in American history.”', 'AP’S ASSESSMENT: That’s incorrect. The debt incurred during the Trump era was very high. But in terms of raw dollars, the total debt rose more under former President Barack Obama, with Trump in second place — though Obama held office for two terms, while Trump served one.', 'There are other ways to slice and dice the numbers, experts say. But more importantly, the debt has been ballooning for years and it’s more complicated than blaming any one leader or party. Trump, for example, was faced with the COVID-19 pandemic, prompting bipartisan support for a ', '.', 'Jeffries offered a more simplistic view when casting blame on the 45th president in a tweet, which was copied in a popular Instagram post shared by Occupy Democrats.', '“Trump ran up more debt than any other President in American history,” the post reads. “He wants Republicans to force a dangerous default if they don’t get their way. We cannot let right-wing extremists hold our economy hostage.”', 'Jeffries’ office didn’t provide a response to an inquiry asking how the measure was calculated.', 'But in terms of all presidents, the Trump years did not record the most debt added — although they did add a lot.', 'Looking at ', ' by fiscal year, the total gross U.S. debt was about $19.5 trillion at the end of fiscal year 2016, which ended several months before Trump took office, said G. William Hoagland, senior vice president at the Bipartisan Policy Center. That rose to about $26.9 trillion at the end of fiscal year 2020, or a $7.4 trillion increase, just before Trump left office.', 'The debt added under Obama’s two terms, however, amounted to about $9.5 trillion.', 'There are some caveats: Those figures are not adjusted for inflation. A federal fiscal year begins in October, so there is some overlap when administrations change. And the total debt ', ' debt held by the public, which accounts for most of the debt, but also debt owed by one part of the government to another.', 'There are also different ways to analyze the data.', 'Evaluating only full one-term presidencies, for example, the rise under Trump may well be on paper the largest increase. But the increase under former President George H. W. Bush — about $1.4 trillion — represented a larger percentage increase than under Trump, Hoagland noted.', 'And some economists prefer to view the national debt as a percentage of the U.S. gross domestic product, or GDP, because it indicates the ability of the country to handle its debt.', '“Compare it to a household,” explained Eugene Steuerle, co-founder of the Urban-Brookings Tax Policy Center. “The higher the household’s wages, the more it can pay off its debt.”', 'Looking at it that way, the gross debt as a percentage of GDP reached an all-time high of nearly 128% at the end of Trump’s tenure, according to the historical federal data. That said, it’s represented more than 100% of GDP since 2013; that burden in relation to the size of the economy was previously unseen since World War II.', 'But the debt accumulated under specific presidents isn’t just a result of their own policies — it reflects decisions made by their predecessors as well as by members of Congress.', '“The point is that fiscal policy reflects joint action by Congress and the president,” said David Primo, a University of Rochester professor of political science and business administration. Statements like Jeffries’ imply presidents have sole control over fiscal policy, he noted.', 'Similarly, Hoagland said: “All presidents inherit spending from previous administrations and in turn they create spending for the future president.”', 'The cost of programs like Social Security and Medicare continue to drive up the debt, as do factors beyond a president’s control, like COVID-19 or the recession inherited by Obama.', '“As a budget expert, what pains me is that partisan bickering about who is to blame for the debt obscures an important truth: both parties have abdicated their budgetary responsibilities,” Primo said, noting that about two-thirds of the debt has been incurred since 2001.', '___', 'This is part of AP’s effort to address widely shared misinformation, including work with outside companies and organizations to add factual context to misleading content that is circulating online. ', '.']"
https://apnews.com/article/fact-check-national-debt-donald-trump-barack-obama-ee3e613646fe500edf803e57959c776e,"['How the US helping Ukraine acquire F-16s shows that for military aid, ‘no’ can become ‘yes’']","['WASHINGTON (AP) — The U.S. has once again buckled under pressure from European allies and Ukraine’s leaders and agreed to provide more sophisticated weapons to the war effort. This time it’s all about F-16 fighter jets.', 'Ukraine has long begged for the sophisticated fighter to give it a combat edge as it battles Russia’s invasion, now in its second year. And this new plan opens the door for several nations to supply the fourth-generation aircraft and for the U.S. to help train the pilots. ', ' to world leaders meeting in Hiroshima, Japan, on Friday, according to U.S. officials.', 'So far, however, the U.S. has provided no details and said decisions on when, how many, and who will supply the F-16s will be made in the months ahead while the training is underway. Details on the training are equally elusive. U.S. officials spoke on condition of anonymity to discuss decisions not yet made public.', 'Still, with this decision, the Biden administration has made a sharp reversal, after refusing to approve any transfer of the aircraft or conduct training for more than a year due to worries that it could escalate tensions with Russia. U.S. officials also have argued against the F-16 by saying that learning to fly and logistically support such an advanced aircraft would be difficult and take months.', 'Here is a look at the fighters, why the U.S. has been reluctant to provide them to Ukraine and what is known and not known yet about the decision.', 'WHY DOES UKRAINE WANT F-16 FIGHTER JETS?', 'Ukraine has pressed for Western jets since the very earliest stages of the war, insisting that the sophisticated aircraft would give them a leg up in the war and allow them to strike Russian forces.', 'Nearly a year ago, two Ukrainian fighter pilots who asked to be identified by their callsigns “Moonfish” and “Juice” met with reporters in Washington to argue for getting the F-16 Fighting Falcons, which have more advanced radars, sensors and missile capabilities. ', 'In February, Ukrainian Defense Minister Oleksiy Reznikov ', ' when he was asked in Brussels what military aid his country needed. And earlier this month Ukrainian President Volodymyr Zelenskyy said during a visit to Germany that he was pushing for allies to forge a “fighter jet coalition” that would provide Ukraine with the combat planes it needs to counter Russia’s air dominance.', 'Ukraine’s leaders have argued that the F-16 is far superior to their existing fleet of Soviet-era warplanes. In response to those pleas, the U.S. has found ways to deliver some of the advanced capabilities without providing the actual jets.', 'For example, Air Force engineers found ways to modify the HARM air-to-surface anti-radiation missile so that it could be carried and fired by Ukrainian-flown MiGs. The missile and its targeting system enable the jet to identify enemy ground radars and destroy them.', 'WHY HAS THE U.S. BALKED?', 'Repeatedly for months senior U.S. officials — from Biden on down — had flatly rejected sending F-16s to Ukraine, when asked publicly. And the U.S. had so far declined to allow other countries to export their U.S.-made Falcons to Ukraine.', 'As recently as Monday, after Zelenskyy reiterated his desire for F-16s and other jets, National Security Council spokesman John Kirby was asked if the U.S. had in any way changed its position on F-16s not being the right focus for military aid. Kirby said, “No.”', 'Asked similar questions in recent months, Biden also declined to approve the F-16s. In one instance earlier this year he was asked why he opposed sending them, and he responded, “Because we should keep them here.”', 'U.S. officials at the Pentagon have insisted that the military aid the U.S. was providing to Ukraine was based on what the country needed most to fight the war. So the emphasis has been on sending air defense systems and millions of rounds of rockets, missiles and other ammunition — as Ukraine prepares for a ', '.', 'The other key reason, however, is the ongoing concern that sending fighter jets to Ukraine would enrage the Russians, provoke President Vladimir Putin and possibly escalate or broaden the war.', 'WELL, ON SECOND THOUGHT ....', 'Despite all the concerns, the U.S. has proven again and again during the war that it can change its mind.', 'Early on the U.S. balked at sending Patriot missile batteries, longer-range missiles or tanks. And in each case, it eventually succumbed to pressure from allies and agreed to send the increasingly advanced weapons.', 'Of note was the ', '. For months the U.S. had said the Abrams was too complicated and required too much logistical support for Ukrainian troops. Under escalating pressure from European nations that wanted to send Ukraine their own tanks, the U.S. finally agreed to send 31 Abrams to Ukraine. Training is expected to begin soon.', 'The F-16 approval has been a long, slow slog. Despite public insistence — for months — that there was no movement on the F-16s, the Pentagon in March brought two Ukrainian Air Force pilots to the Morris Air National Guard Base in Tucson, Arizona, to familiarize them with the F-16 and learn how pilots are trained.', 'U.S. officials refused to discuss the event publicly, but privately they said the two pilots flew F-16 simulators and got a feel for the training. The U.S. Air Force, meanwhile, got insight into how long it would take for an experienced Ukrainian fighter pilot to learn the F-16′s more advanced systems. Officials determined that realistically it could be done in about four months, if the pilots were already trained to fly their own Soviet-era fighters.', 'WHAT WE STILL DON’T KNOW', 'According to U.S. officials, Biden told leaders in Japan that the U.S. will participate in the F-16 training, and that decisions on providing the jets will come later. ', 'Officials said it’s still not clear if the U.S. will simply allow other nations to send F-16s to Ukraine, or if the U.S. will also send some. And there are no estimates on how many of the jets will be provided or when. Officials acknowledge that it will not be in time for the anticipated spring offensive.', 'And while officials said the training will begin soon, it isn’t yet clear where it will be, how many pilots will be trained and how long it will take.', 'The U.S. Air Force has two F-16 air wings in Europe: the 31st Fighter Wing at the Aviano Air Base in Italy and the 52nd Fighter Wing at Spangdahlem Air Base in Germany. The U.S. also routinely sends F-16 fighters in and out of Europe on a rotational basis in smaller groups.']"
